[
  {
    "event_id": "evt-sf012-positive-01",
    "timestamp": "2026-02-03T14:00:00Z",
    "event_source": "CommonSecurityLog",
    "event_type": "firewall_traffic",
    "host": "ws-712.sentinelforge.test",
    "user": "alex.morgan@example.test",
    "source_ip": "198.51.100.112",
    "destination_ip": "203.0.113.212",
    "action": "allow",
    "result": "success",
    "correlation_id": "corr-sf012-positive",
    "raw_event_ref": "synthetic://fixtures/sf012-positive-01",
    "normalized": {
      "device_vendor": "Palo Alto Networks",
      "destination_port": 443,
      "application": "ssl",
      "bytes_sent": 612
    }
  },
  {
    "event_id": "evt-sf012-positive-02",
    "timestamp": "2026-02-03T14:01:00Z",
    "event_source": "CommonSecurityLog",
    "event_type": "firewall_traffic",
    "host": "ws-712.sentinelforge.test",
    "user": "alex.morgan@example.test",
    "source_ip": "198.51.100.112",
    "destination_ip": "203.0.113.212",
    "action": "allow",
    "result": "success",
    "correlation_id": "corr-sf012-positive",
    "raw_event_ref": "synthetic://fixtures/sf012-positive-02",
    "normalized": {
      "device_vendor": "Palo Alto Networks",
      "destination_port": 443,
      "application": "ssl",
      "bytes_sent": 612
    }
  },
  {
    "event_id": "evt-sf012-positive-03",
    "timestamp": "2026-02-03T14:02:00Z",
    "event_source": "CommonSecurityLog",
    "event_type": "firewall_traffic",
    "host": "ws-712.sentinelforge.test",
    "user": "alex.morgan@example.test",
    "source_ip": "198.51.100.112",
    "destination_ip": "203.0.113.212",
    "action": "allow",
    "result": "success",
    "correlation_id": "corr-sf012-positive",
    "raw_event_ref": "synthetic://fixtures/sf012-positive-03",
    "normalized": {
      "device_vendor": "Palo Alto Networks",
      "destination_port": 443,
      "application": "ssl",
      "bytes_sent": 612
    }
  },
  {
    "event_id": "evt-sf012-positive-04",
    "timestamp": "2026-02-03T14:03:01Z",
    "event_source": "CommonSecurityLog",
    "event_type": "firewall_traffic",
    "host": "ws-712.sentinelforge.test",
    "user": "alex.morgan@example.test",
    "source_ip": "198.51.100.112",
    "destination_ip": "203.0.113.212",
    "action": "allow",
    "result": "success",
    "correlation_id": "corr-sf012-positive",
    "raw_event_ref": "synthetic://fixtures/sf012-positive-04",
    "normalized": {
      "device_vendor": "Palo Alto Networks",
      "destination_port": 443,
      "application": "ssl",
      "bytes_sent": 612
    }
  },
  {
    "event_id": "evt-sf012-positive-05",
    "timestamp": "2026-02-03T14:04:00Z",
    "event_source": "CommonSecurityLog",
    "event_type": "firewall_traffic",
    "host": "ws-712.sentinelforge.test",
    "user": "alex.morgan@example.test",
    "source_ip": "198.51.100.112",
    "destination_ip": "203.0.113.212",
    "action": "allow",
    "result": "success",
    "correlation_id": "corr-sf012-positive",
    "raw_event_ref": "synthetic://fixtures/sf012-positive-05",
    "normalized": {
      "device_vendor": "Palo Alto Networks",
      "destination_port": 443,
      "application": "ssl",
      "bytes_sent": 612
    }
  },
  {
    "event_id": "evt-sf012-positive-06",
    "timestamp": "2026-02-03T14:05:00Z",
    "event_source": "CommonSecurityLog",
    "event_type": "firewall_traffic",
    "host": "ws-712.sentinelforge.test",
    "user": "alex.morgan@example.test",
    "source_ip": "198.51.100.112",
    "destination_ip": "203.0.113.212",
    "action": "allow",
    "result": "success",
    "correlation_id": "corr-sf012-positive",
    "raw_event_ref": "synthetic://fixtures/sf012-positive-06",
    "normalized": {
      "device_vendor": "Palo Alto Networks",
      "destination_port": 443,
      "application": "ssl",
      "bytes_sent": 612
    }
  }
]
