[
  {
    "event_id": "evt-sf006-positive-01",
    "timestamp": "2026-02-03T14:00:00Z",
    "event_source": "DeviceProcessEvents",
    "event_type": "process_access",
    "host": "ws-417.sentinelforge.test",
    "user": "alex.morgan@example.test",
    "source_ip": "198.51.100.77",
    "destination_ip": "203.0.113.44",
    "action": "open_process",
    "result": "success",
    "correlation_id": "corr-sf006-positive",
    "raw_event_ref": "synthetic://fixtures/sf006-positive-01",
    "normalized": {
      "file_name": "unapproved-diagnostic.exe",
      "target_process": "lsass.exe",
      "access_type": "memory_read",
      "approved_security_tool": false
    }
  }
]
