[
  {
    "event_id": "evt-sf004-positive-01",
    "timestamp": "2026-02-03T14:00:00Z",
    "event_source": "SigninLogs",
    "event_type": "mfa_challenge",
    "host": "ws-417.sentinelforge.test",
    "user": "alex.morgan@example.test",
    "source_ip": "198.51.100.77",
    "destination_ip": "203.0.113.44",
    "action": "mfa_verify",
    "result": "failure",
    "correlation_id": "corr-sf004-positive",
    "raw_event_ref": "synthetic://fixtures/sf004-positive-01",
    "normalized": {
      "mfa_result": "denied",
      "application": "Finance Training"
    }
  },
  {
    "event_id": "evt-sf004-positive-02",
    "timestamp": "2026-02-03T14:02:00Z",
    "event_source": "SigninLogs",
    "event_type": "mfa_challenge",
    "host": "ws-417.sentinelforge.test",
    "user": "alex.morgan@example.test",
    "source_ip": "198.51.100.77",
    "destination_ip": "203.0.113.44",
    "action": "mfa_verify",
    "result": "failure",
    "correlation_id": "corr-sf004-positive",
    "raw_event_ref": "synthetic://fixtures/sf004-positive-02",
    "normalized": {
      "mfa_result": "denied",
      "application": "Finance Training"
    }
  },
  {
    "event_id": "evt-sf004-positive-03",
    "timestamp": "2026-02-03T14:04:00Z",
    "event_source": "SigninLogs",
    "event_type": "mfa_challenge",
    "host": "ws-417.sentinelforge.test",
    "user": "alex.morgan@example.test",
    "source_ip": "198.51.100.77",
    "destination_ip": "203.0.113.44",
    "action": "mfa_verify",
    "result": "failure",
    "correlation_id": "corr-sf004-positive",
    "raw_event_ref": "synthetic://fixtures/sf004-positive-03",
    "normalized": {
      "mfa_result": "denied",
      "application": "Finance Training"
    }
  },
  {
    "event_id": "evt-sf004-positive-04",
    "timestamp": "2026-02-03T14:06:00Z",
    "event_source": "SigninLogs",
    "event_type": "mfa_challenge",
    "host": "ws-417.sentinelforge.test",
    "user": "alex.morgan@example.test",
    "source_ip": "198.51.100.77",
    "destination_ip": "203.0.113.44",
    "action": "mfa_verify",
    "result": "failure",
    "correlation_id": "corr-sf004-positive",
    "raw_event_ref": "synthetic://fixtures/sf004-positive-04",
    "normalized": {
      "mfa_result": "denied",
      "application": "Finance Training"
    }
  },
  {
    "event_id": "evt-sf004-positive-05",
    "timestamp": "2026-02-03T14:08:00Z",
    "event_source": "SigninLogs",
    "event_type": "mfa_challenge",
    "host": "ws-417.sentinelforge.test",
    "user": "alex.morgan@example.test",
    "source_ip": "198.51.100.77",
    "destination_ip": "203.0.113.44",
    "action": "mfa_verify",
    "result": "failure",
    "correlation_id": "corr-sf004-positive",
    "raw_event_ref": "synthetic://fixtures/sf004-positive-05",
    "normalized": {
      "mfa_result": "denied",
      "application": "Finance Training"
    }
  },
  {
    "event_id": "evt-sf004-positive-06",
    "timestamp": "2026-02-03T14:10:00Z",
    "event_source": "SigninLogs",
    "event_type": "mfa_challenge",
    "host": "ws-417.sentinelforge.test",
    "user": "alex.morgan@example.test",
    "source_ip": "198.51.100.77",
    "destination_ip": "203.0.113.44",
    "action": "mfa_verify",
    "result": "success",
    "correlation_id": "corr-sf004-positive",
    "raw_event_ref": "synthetic://fixtures/sf004-positive-06",
    "normalized": {
      "mfa_result": "approved",
      "application": "Finance Training"
    }
  }
]
