[
  {
    "event_id": "evt-sf010-positive-01",
    "timestamp": "2026-02-03T14:00:00Z",
    "event_source": "DeviceNetworkEvents",
    "event_type": "dns_query",
    "host": "ws-417.sentinelforge.test",
    "user": "alex.morgan@example.test",
    "source_ip": "198.51.100.77",
    "destination_ip": "203.0.113.53",
    "action": "resolve",
    "result": "success",
    "correlation_id": "corr-sf010-positive",
    "raw_event_ref": "synthetic://fixtures/sf010-positive-01",
    "normalized": {
      "protocol": "dns",
      "query": "a1b2c3d4e5f6g7h8i9j0k1l2m3n4o5p6q7r8s9t0u1v2w3x40.telemetry.example.test",
      "initiating_process": "training-agent.exe"
    }
  },
  {
    "event_id": "evt-sf010-positive-02",
    "timestamp": "2026-02-03T14:01:00Z",
    "event_source": "DeviceNetworkEvents",
    "event_type": "dns_query",
    "host": "ws-417.sentinelforge.test",
    "user": "alex.morgan@example.test",
    "source_ip": "198.51.100.77",
    "destination_ip": "203.0.113.53",
    "action": "resolve",
    "result": "success",
    "correlation_id": "corr-sf010-positive",
    "raw_event_ref": "synthetic://fixtures/sf010-positive-02",
    "normalized": {
      "protocol": "dns",
      "query": "a1b2c3d4e5f6g7h8i9j0k1l2m3n4o5p6q7r8s9t0u1v2w3x41.telemetry.example.test",
      "initiating_process": "training-agent.exe"
    }
  },
  {
    "event_id": "evt-sf010-positive-03",
    "timestamp": "2026-02-03T14:02:00Z",
    "event_source": "DeviceNetworkEvents",
    "event_type": "dns_query",
    "host": "ws-417.sentinelforge.test",
    "user": "alex.morgan@example.test",
    "source_ip": "198.51.100.77",
    "destination_ip": "203.0.113.53",
    "action": "resolve",
    "result": "success",
    "correlation_id": "corr-sf010-positive",
    "raw_event_ref": "synthetic://fixtures/sf010-positive-03",
    "normalized": {
      "protocol": "dns",
      "query": "a1b2c3d4e5f6g7h8i9j0k1l2m3n4o5p6q7r8s9t0u1v2w3x42.telemetry.example.test",
      "initiating_process": "training-agent.exe"
    }
  },
  {
    "event_id": "evt-sf010-positive-04",
    "timestamp": "2026-02-03T14:03:00Z",
    "event_source": "DeviceNetworkEvents",
    "event_type": "dns_query",
    "host": "ws-417.sentinelforge.test",
    "user": "alex.morgan@example.test",
    "source_ip": "198.51.100.77",
    "destination_ip": "203.0.113.53",
    "action": "resolve",
    "result": "success",
    "correlation_id": "corr-sf010-positive",
    "raw_event_ref": "synthetic://fixtures/sf010-positive-04",
    "normalized": {
      "protocol": "dns",
      "query": "a1b2c3d4e5f6g7h8i9j0k1l2m3n4o5p6q7r8s9t0u1v2w3x43.telemetry.example.test",
      "initiating_process": "training-agent.exe"
    }
  }
]
