[
  {
    "event_id": "evt-sf003-positive-01",
    "timestamp": "2026-02-03T14:00:00Z",
    "event_source": "SigninLogs",
    "event_type": "interactive_sign_in",
    "host": "ws-417.sentinelforge.test",
    "user": "alex.morgan@example.test",
    "source_ip": "198.51.100.80",
    "destination_ip": "203.0.113.44",
    "action": "authenticate",
    "result": "success",
    "correlation_id": "corr-sf003-positive",
    "raw_event_ref": "synthetic://fixtures/sf003-positive-01",
    "normalized": {
      "latitude": 47.6062,
      "longitude": -122.3321,
      "country": "US"
    }
  },
  {
    "event_id": "evt-sf003-positive-02",
    "timestamp": "2026-02-03T15:00:00Z",
    "event_source": "SigninLogs",
    "event_type": "interactive_sign_in",
    "host": "ws-417.sentinelforge.test",
    "user": "alex.morgan@example.test",
    "source_ip": "198.51.100.81",
    "destination_ip": "203.0.113.44",
    "action": "authenticate",
    "result": "success",
    "correlation_id": "corr-sf003-positive",
    "raw_event_ref": "synthetic://fixtures/sf003-positive-02",
    "normalized": {
      "latitude": 51.5074,
      "longitude": -0.1278,
      "country": "GB"
    }
  }
]
